{
  "id": "the-13-14-15-triangle",
  "title": "The 13-14-15 Triangle",
  "kyu": 6,
  "topic": "G",
  "subtopics": [
    "heron",
    "inradius"
  ],
  "type": "answer",
  "status": "beta",
  "statement": "A triangle has sides $13$, $14$ and $15$. Find the radius of its inscribed circle.",
  "answer_format": "integer_0_999",
  "answer_hash": "75eefc37",
  "hints": [
    "Area $=$ inradius $\\times$ semiperimeter.",
    "Heron's formula, or drop the altitude to the side of length $14$."
  ],
  "solution": "The semiperimeter is $s = 21$ and Heron gives area $\\sqrt{21\\cdot 8\\cdot 7\\cdot 6} = 84$. Then $r = 84/21 = 4$.",
  "provenance": {
    "kind": "original",
    "author": "kevinvariant"
  },
  "verification": "seed-unverified",
  "stats": {
    "solves": 0,
    "attempts": 0,
    "liked": 0
  }
}
