{
  "id": "odd-meets-even",
  "title": "Odd Meets Even",
  "kyu": 5,
  "topic": "C",
  "subtopics": [
    "polynomial-factoring",
    "rule-of-product"
  ],
  "type": "answer",
  "status": "beta",
  "statement": "Let $x_1, x_2, x_3, x_4, x_5, x_6$ be a permutation of the numbers $1, 2, 3, 4, 5, 6$. Let $S$ be the sum of the nine products $x_i x_j$ with $i \\in \\{1, 3, 5\\}$ and $j \\in \\{2, 4, 6\\}$.\n\nFind the number of such permutations for which $S$ is divisible by $7$.",
  "answer_format": "integer_0_999",
  "answer_hash": "8e0b49d3",
  "hints": [
    "Collect the terms of $S$ that contain $x_1$, then those that contain $x_3$, and then those that contain $x_5$. Compare the three brackets you get.",
    "Use factorisation: $S = A \\cdot B$, where $A = x_1 + x_3 + x_5$ and $B = x_2 + x_4 + x_6$. Since $7$ is prime, it divides $S$ only if it divides $A$ or $B$. Also note that $A + B$ has a fixed value.",
    "Since $A + B = 21$, the prime $7$ divides $A$ exactly when it divides $B$, so $7$ divides $S$ exactly when $7$ divides $A$. As $6 \\le A \\le 15$, this means that $A = 7$ or $A = 14$, so $\\{x_1, x_3, x_5\\}$ must be $\\{1, 2, 4\\}$ or $\\{3, 5, 6\\}$. It remains to count the arrangements of the numbers within the odd and even positions."
  ],
  "solution": "Let $A = x_1 + x_3 + x_5$ and $B = x_2 + x_4 + x_6$. Expanding the product $A \\cdot B$ gives exactly the nine terms $x_i x_j$ with $i \\in \\{1, 3, 5\\}$ and $j \\in \\{2, 4, 6\\}$, so $S = A \\cdot B$. Also, $A + B = 1 + 2 + 3 + 4 + 5 + 6 = 21$, which is divisible by $7$.\n\nSince $7$ is prime, it divides $S$ exactly when it divides $A$ or $B$. Because $A + B$ is divisible by $7$, either of these conditions implies the other. Hence $7$ divides $S$ exactly when $7$ divides $A$.\n\nThe sum of three distinct numbers from $1$ to $6$ lies between $1 + 2 + 3 = 6$ and $4 + 5 + 6 = 15$, so we need $A = 7$ or $A = 14$. Suppose that $A = 7$. The smallest of the three numbers must be $1$, because otherwise $A \\ge 2 + 3 + 4 = 9$. The other two numbers are then distinct, greater than $1$ and sum to $6$, so they must be $2$ and $4$. Thus the only set is $\\{1, 2, 4\\}$. Now suppose that $A = 14$. Then $B = 7$, so by the same argument $\\{x_2, x_4, x_6\\} = \\{1, 2, 4\\}$, and therefore $\\{x_1, x_3, x_5\\} = \\{3, 5, 6\\}$.\n\nSo there are two possible sets for the odd positions, and each one determines the set for the even positions. Each set can be arranged in its three positions in $3!$ ways, so the number of permutations is $2 \\cdot 3! \\cdot 3!$. The answer is $72$.\n\n<b>Why this works.</b> <code>polynomial-factoring</code>, <code>rule-of-product</code>: factorising $S$ reduces divisibility by a prime to a condition on one three-element subset, whose arrangements are then counted independently.",
  "provenance": {
    "kind": "original",
    "author": "kyuclid",
    "pipeline_run": "full-1"
  },
  "stats": {
    "solves": 0,
    "attempts": 0,
    "liked": 0
  },
  "verification": "gate-2026-10-31-odd-meets-even"
}
