{
  "id": "whole-number-distances",
  "title": "Whole Number Distances",
  "kyu": 4,
  "topic": "G",
  "subtopics": [
    "reflection-across-line",
    "angle-bisector-theorem",
    "divisor-counting"
  ],
  "type": "answer",
  "status": "beta",
  "statement": "Triangle $ABC$ has a right angle at $B$, with $AB = 90$, and the length $AC$ is an integer. The length $BC$ need not be an integer.\n\nLet $D$ be the point such that ray $AD$ is the internal bisector of angle $BAC$ and ray $CB$ is the internal bisector of angle $ACD$.\n\nFor how many integer values of $AC$ is the length $CD$ also an integer?",
  "answer_format": "integer_0_999",
  "answer_hash": "bd69a788",
  "hints": [
    "Line $BC$ is perpendicular to $AB$ and bisects angle $ACD$. Extend $AB$ beyond $B$ to the point $E$ with $BE = AB$, and look at triangle $ACE$. Where does $D$ lie in relation to this triangle?",
    "Reflection in line $BC$ sends $A$ to $E$ and ray $CA$ to ray $CD$, so $D$ lies on side $CE$ of triangle $ACE$, where $CE = AC$ and $AE = 180$. Since $AD$ bisects angle $CAE$, apply the angle bisector theorem to find $CD$ in terms of $h = AC$.",
    "The angle bisector theorem gives $CD = \\frac{h^2}{h+180}$, where $h = AC$. Since $h^2 = (h-180)(h+180) + 180^2$, the length $CD$ is an integer exactly when $h + 180$ divides $32400$. The triangle requires $h > 90$, so it remains to count the divisors of $32400$ in the corresponding range."
  ],
  "solution": "Let $h = AC$, and let $E$ be the reflection of $A$ in line $BC$. Since $AB \\perp BC$, the point $B$ is the midpoint of $AE$, so $AE = 180$, and the reflection gives $CE = CA = h$.\n\nSince ray $CB$ is the internal bisector of angle $ACD$, ray $CD$ is the reflection of ray $CA$ in line $BC$, which is ray $CE$. Also, ray $AB$ is the same as ray $AE$, so $AD$ is the internal bisector of angle $CAE$ in triangle $ACE$. Therefore $D$ is the point where this bisector meets side $CE$. In particular, $D$ exists and is unique for every $h > 90$.\n\nBy the angle bisector theorem, $\\frac{CD}{DE} = \\frac{AC}{AE} = \\frac{h}{180}$. Since $CD + DE = CE = h$, we get\n$$CD = \\dfrac{h}{h+180} \\cdot h = \\dfrac{h^2}{h+180}.$$\n\nNow $h^2 = (h-180)(h+180) + 180^2$. So for integer $h$, the length $CD$ is an integer exactly when $h + 180$ divides $180^2 = 32400 = 2^4 \\cdot 3^4 \\cdot 5^2$.\n\nThe triangle exists exactly when $h > 90$, since the hypotenuse must exceed the leg $AB$, and then $BC = \\sqrt{h^2 - 8100}$ is a positive length. So the valid values of $h$ correspond one-to-one with the divisors $d = h + 180$ of $32400$ satisfying $d > 270$.\n\nSince $32400 = 270 \\cdot 120$, we have $d > 270$ exactly when the complementary divisor $\\frac{32400}{d}$ is less than $120$. So we count the divisors of $32400$ below $120$, grouped by the power of $5$ they contain.\n\nWith no factor of $5$, the divisors are $1, 2, 3, 4, 6, 8, 9, 12, 16, 18, 24, 27, 36, 48, 54, 72, 81, 108$, which gives $18$ divisors.\n\nWith exactly one factor of $5$, the divisors are $5, 10, 15, 20, 30, 40, 45, 60, 80, 90$, which gives $10$ divisors.\n\nWith exactly two factors of $5$, the divisors are $25, 50, 75, 100$, which gives $4$ divisors.\n\nThe total is $18 + 10 + 4 = 32$, so the answer is $32$.\n\n<b>Why this works.</b> <code>reflection-across-line</code>, <code>angle-bisector-theorem</code>, <code>divisor-counting</code>: reflecting $A$ in $BC$ puts $D$ on a side of an isosceles triangle, where the bisector ratio gives a rational formula for $CD$ that turns integrality into a divisor count.",
  "provenance": {
    "kind": "original",
    "author": "kyuclid",
    "pipeline_run": "pilot-1"
  },
  "stats": {
    "solves": 0,
    "attempts": 0,
    "liked": 0
  },
  "verification": "gate-2026-10-31-whole-number-distances"
}
