{
  "id": "smallest-completions",
  "title": "Smallest Completions",
  "kyu": 6,
  "topic": "N",
  "subtopics": [
    "multiplicativity",
    "perfect-square-exponent-parity",
    "prime-factorization"
  ],
  "type": "answer",
  "status": "beta",
  "statement": "For each positive integer $d$, let $s(d)$ be the smallest positive integer such that $d \\cdot s(d)$ is a perfect square. Find the sum of $s(d)$ taken over all positive divisors $d$ of $30^4$.",
  "answer_format": "integer_0_999",
  "answer_hash": "5c4df804",
  "hints": [
    "Since $30^4 = 2^4 \\cdot 3^4 \\cdot 5^4$, every divisor has the form $d = 2^a 3^b 5^c$ with $0 \\le a, b, c \\le 4$. Work out what $s(d)$ is in terms of the exponents $a$, $b$ and $c$.",
    "A number is a perfect square exactly when all its prime exponents are even, so $s(d)$ is the product of the primes that have an odd exponent in $d$. Each prime's contribution depends only on its own exponent, so use multiplicativity: the sum over all divisors factorises into one sum for each prime.",
    "Write $d = 2^a 3^b 5^c$ and treat one prime $p \\in \\{2, 3, 5\\}$ at a time. Among the exponents $0, 1, 2, 3, 4$, the three even ones each contribute a factor of $1$ to $s(d)$, and the two odd ones each contribute a factor of $p$. So the sum for $p$ is $3 + 2p$, and the required total is the product of these sums over $p = 2, 3, 5$."
  ],
  "solution": "Since $30^4 = 2^4 \\cdot 3^4 \\cdot 5^4$, the divisors of $30^4$ are exactly the numbers $d = 2^a 3^b 5^c$ with $0 \\le a, b, c \\le 4$, and each triple $(a, b, c)$ gives exactly one divisor.\n\nFirst we find $s(d)$. A positive integer is a perfect square exactly when every prime exponent in its factorisation is even. Suppose $d \\cdot t$ is a perfect square. If a prime $p$ has an odd exponent in $d$, then it must have an odd exponent in $t$, so $p$ divides $t$. Hence $t$ is divisible by the product of all such primes, and so $t$ is at least that product. Multiplying $d$ by this product makes every exponent even, so the bound is attained. Therefore $s(d)$ is exactly the product of the primes with an odd exponent in $d$.\n\nFor a prime $p$ and an exponent $e$, let $f_p(e) = 1$ if $e$ is even and $f_p(e) = p$ if $e$ is odd. Then $s(2^a 3^b 5^c) = f_2(a) \\cdot f_3(b) \\cdot f_5(c)$. Expanding the product below gives one term for each triple $(a, b, c)$, so\n$$\\sum_{d \\mid 30^4} s(d) = \\left(\\sum_{a=0}^{4} f_2(a)\\right)\\left(\\sum_{b=0}^{4} f_3(b)\\right)\\left(\\sum_{c=0}^{4} f_5(c)\\right).$$\n\nAmong the exponents $0, 1, 2, 3, 4$, three are even and two are odd, so $\\sum_{e=0}^{4} f_p(e) = 3 + 2p$. The three brackets are therefore $3 + 2 \\cdot 2 = 7$, $3 + 2 \\cdot 3 = 9$ and $3 + 2 \\cdot 5 = 13$.\n\nThe sum is $7 \\cdot 9 \\cdot 13 = 819$. The answer is $819$.\n\n<b>Why this works.</b> <code>multiplicativity</code>, <code>perfect-square-exponent-parity</code>: being a perfect square depends only on the parity of each prime's exponent, so $s(d)$ splits into independent prime factors and the divisor sum factorises.",
  "provenance": {
    "kind": "original",
    "author": "kyuclid",
    "pipeline_run": "full-1"
  },
  "stats": {
    "solves": 0,
    "attempts": 0,
    "liked": 0
  },
  "verification": "gate-2026-10-31-smallest-completions"
}
