{
  "id": "a-whole-total",
  "title": "A Whole Total",
  "kyu": 4,
  "topic": "N",
  "subtopics": [
    "multiplicativity",
    "prime-factorization"
  ],
  "type": "answer",
  "status": "beta",
  "statement": "For a positive integer $n$, let $R(n)$ be the set of all rational numbers that can be written as $\\frac{a}{b}$, where $a$ and $b$ are positive divisors of $n$. Let $S(n)$ be the sum of the elements of $R(n)$, with each element counted once. Find the smallest integer $n > 1$ for which $S(n)$ is an integer.",
  "answer_format": "integer_0_999",
  "answer_hash": "ad4e6cb7",
  "hints": [
    "Try a small case such as $n = 12$. Instead of listing the fractions $\\frac{a}{b}$, look at the exponent of each prime in $\\frac{a}{b}$ and ask which exponents can occur.",
    "Each prime's exponent in $\\frac{a}{b}$ can be chosen independently of the other primes, so use multiplicativity: write $S(n)$ as a product over the prime powers $p^k$ exactly dividing $n$, where each factor is a sum of the powers $p^e$ with $-k \\le e \\le k$.",
    "The product from multiplicativity gives $S(n) = \\frac{A(n)}{n}$, where $A(n)$ is the product of the sums $1 + p + \\dots + p^{2k}$ over the prime powers $p^k$ exactly dividing $n$. Show that $A(n)$ is always odd and that $A(p^k) \\equiv 1 \\pmod p$. This rules out even $n$ and prime powers, so test the remaining $n$ in increasing order."
  ],
  "solution": "Let $n > 1$, and suppose $p^k$ exactly divides $n$. For divisors $a, b$ of $n$, the exponent of $p$ in $\\frac{a}{b}$ is $v_p(a) - v_p(b)$, which lies between $-k$ and $k$.\n\nConversely, choose any integer $e_p$ with $-k \\le e_p \\le k$ for each prime $p$ dividing $n$, where $k$ is the exponent of $p$ in $n$. Then the rational number $\\prod_p p^{e_p}$ lies in $R(n)$, because it equals $\\frac{a}{b}$ with $a = \\prod_{e_p > 0} p^{e_p}$ and $b = \\prod_{e_p < 0} p^{-e_p}$, both divisors of $n$.\n\nA positive rational is determined by its prime exponents, so the elements of $R(n)$ correspond exactly to these choices of exponents, each element once. Expanding the product below therefore gives each element of $R(n)$ exactly once:\n$$S(n) = \\prod_{p^k \\| n} \\sum_{e=-k}^{k} p^e = \\prod_{p^k \\| n} \\dfrac{1 + p + \\dots + p^{2k}}{p^k} = \\dfrac{A(n)}{n},$$\nwhere $A(n) = \\prod_{p^k \\| n} \\left(1 + p + \\dots + p^{2k}\\right)$. So $S(n)$ is an integer exactly when $n$ divides $A(n)$.\n\n<b>Even $n$ fail.</b> Each factor of $A(n)$ is odd. For $p = 2$ it is $1$ plus an even number, and for odd $p$ it is a sum of $2k + 1$ odd terms. So $A(n)$ is odd, and an even $n$ cannot divide it.\n\n<b>Prime powers fail.</b> If $n = p^k$, then $A(n) = 1 + p + \\dots + p^{2k} \\equiv 1 \\pmod p$, so $p$ does not divide $A(n)$, and hence $n$ does not either.\n\n<b>Remaining candidates.</b> The odd integers from $3$ to $37$ that are not prime powers are $15, 21, 33, 35$. Each is a product of two distinct primes $p$ and $q$, so $A(pq) = (p^2 + p + 1)(q^2 + q + 1)$. We check each one.\n\nFor $n = 15$, we have $A(15) = 13 \\cdot 31 = 403$, which has digit sum $7$ and so is not divisible by $3$.\n\nFor $n = 21$, we have $A(21) = 13 \\cdot 57 = 741 = 7 \\cdot 105 + 6$, which is not divisible by $7$.\n\nFor $n = 33$, we have $A(33) = 13 \\cdot 133 = 1729$, which has digit sum $19$ and so is not divisible by $3$.\n\nFor $n = 35$, we have $A(35) = 31 \\cdot 57 = 1767$, which is not divisible by $5$.\n\nSo no $n$ with $1 < n < 39$ works.\n\n<b>The value $n = 39$ works.</b> We have $A(39) = 13 \\cdot 183 = 2379 = 39 \\cdot 61$, so $S(39) = 61$ is an integer.\n\nTherefore the smallest integer $n > 1$ for which $S(n)$ is an integer is $39$.\n\n<b>Why this works.</b> <code>multiplicativity</code>, <code>prime-factorization</code>: independent prime exponents turn $S(n)$ into a product over prime powers, which reduces the condition to the divisibility $n \\mid A(n)$.",
  "provenance": {
    "kind": "original",
    "author": "kyuclid",
    "pipeline_run": "pilot-1"
  },
  "stats": {
    "solves": 0,
    "attempts": 0,
    "liked": 0
  },
  "verification": "gate-2026-10-31-a-whole-total"
}
