{
  "id": "calm-words",
  "title": "Calm Words",
  "kyu": 3,
  "topic": "C",
  "subtopics": [
    "stars-and-bars",
    "quadratic-discriminant"
  ],
  "type": "answer",
  "status": "beta",
  "statement": "A word is a finite sequence of letters, each of which is $A$, $B$ or $C$. A word is called calm if no two consecutive letters of the word are one $A$ and one $B$, in either order.\n\nFor positive integers $a$ and $b$, let $f(a, b)$ be the number of calm words containing exactly $a$ letters $A$, exactly $b$ letters $B$ and exactly $3$ letters $C$.\n\nFind the sum of $a + b$ over all ordered pairs $(a, b)$ of positive integers such that $f(a, b) = 2092$.",
  "answer_format": "integer_0_999",
  "answer_hash": "36c61b57",
  "hints": [
    "The three letters $C$ cut a word into four stretches, some possibly empty, that contain no $C$. Work out what a single stretch can look like in a calm word.",
    "In a calm word, each of the four stretches between the letters $C$ is all $A$s, all $B$s or empty. Choose which stretches hold $A$s and which hold $B$s, then use stars and bars to share out the letters: $a$ letters $A$ go into $i$ nonempty stretches in $\\binom{a-1}{i-1}$ ways, and likewise for $B$.",
    "Summing over the possible numbers of $A$-stretches and $B$-stretches gives $f(a, b) = 2(a^2 + 3ab + b^2 + 1)$, so the condition becomes $a^2 + 3ab + b^2 = 1045$. Take $a \\le b$, which forces $a \\le 14$, and view this as a quadratic in $b$: its discriminant $5a^2 + 4180$ must be a perfect square. Find the values of $a$ for which this happens, then recover $b$ and include both orders."
  ],
  "solution": "The three letters $C$ split a word into four slots, some possibly empty, that contain no $C$. In a calm word no slot can contain both $A$ and $B$, because somewhere in such a slot an $A$ would be next to a $B$. So each slot holds only $A$s, only $B$s or nothing. Conversely, any such filling is calm, since two neighbouring letters in a slot are equal and neighbouring letters from different slots are separated by a $C$.\n\nSuppose $i$ slots hold $A$s and $j$ slots hold $B$s. Since $a, b \\ge 1$, we have $i, j \\ge 1$, and also $i + j \\le 4$. There are $\\binom{4}{i}\\binom{4-i}{j}$ ways to choose these slots. By stars and bars, there are $\\binom{a-1}{i-1}$ ways to share $a$ letters $A$ among $i$ nonempty slots and $\\binom{b-1}{j-1}$ ways to share the letters $B$. Hence\n$$f(a, b) = \\sum_{\\substack{i, j \\ge 1 \\\\ i + j \\le 4}} \\binom{4}{i}\\binom{4-i}{j}\\binom{a-1}{i-1}\\binom{b-1}{j-1}.$$\n\nWrite $x = a - 1$ and $y = b - 1$. The pairs $(i, j) = (1,1), (1,2), (2,1), (1,3), (3,1), (2,2)$ contribute $12$, $12y$, $12x$, $4\\binom{y}{2}$, $4\\binom{x}{2}$ and $6xy$ respectively. Therefore\n$$f(a, b) = 12 + 12x + 12y + 2x(x-1) + 2y(y-1) + 6xy = 2x^2 + 2y^2 + 6xy + 10x + 10y + 12.$$\nSubstituting back and simplifying gives\n$$f(a, b) = 2(a^2 + 3ab + b^2 + 1).$$\n\nSo $f(a, b) = 2092$ exactly when $a^2 + 3ab + b^2 = 1045$. This equation is symmetric, so first take $a \\le b$. Then $5a^2 \\le a^2 + 3ab + b^2 = 1045$, so $a^2 \\le 209$ and $a \\le 14$.\n\nAs a quadratic in $b$, the equation is $b^2 + 3ab + a^2 - 1045 = 0$, with discriminant $5a^2 + 4180$. Since $b$ is an integer, this must equal $s^2$ for a positive integer $s$, and then the positive root is $b = \\frac{s - 3a}{2}$. As $5$ divides $s^2$, we may write $s = 5t$, which gives $5t^2 = a^2 + 836$. Reducing modulo $5$ gives $a^2 \\equiv 4 \\pmod 5$, so $a \\equiv \\pm 2 \\pmod 5$, and thus $a \\in \\{2, 3, 7, 8, 12, 13\\}$.\n\nFor these values, $t^2 = \\frac{a^2 + 836}{5}$ equals $168, 169, 177, 180, 196, 201$ respectively. The only squares among these are $169$ and $196$. If $a = 3$, then $s = 65$ and $b = 28$. If $a = 12$, then $s = 70$ and $b = 17$. Both pairs satisfy the equation, as $9 + 252 + 784 = 1045$ and $144 + 612 + 289 = 1045$, and both have $a < b$.\n\nThe ordered pairs are therefore $(3, 28)$, $(28, 3)$, $(12, 17)$ and $(17, 12)$. The required sum is $2 \\cdot 31 + 2 \\cdot 29$, so the answer is $120$.\n\n<b>Why this works.</b> <code>stars-and-bars</code>, <code>quadratic-discriminant</code>: sharing letters among the slots between the $C$s collapses the count to a quadratic form, and the discriminant condition then leaves only a short check.",
  "provenance": {
    "kind": "original",
    "author": "kyuclid",
    "pipeline_run": "full-1"
  },
  "stats": {
    "solves": 0,
    "attempts": 0,
    "liked": 0
  },
  "verification": "gate-2026-10-31-calm-words"
}
