{
  "id": "zeros-of-2026",
  "title": "Zeros at the End of 2026!",
  "kyu": 6,
  "topic": "N",
  "subtopics": [
    "legendre-formula"
  ],
  "type": "answer",
  "status": "beta",
  "statement": "How many zeros does $2026!$ end with?",
  "answer_format": "integer_0_999",
  "answer_hash": "5357fb87",
  "hints": [
    "Each trailing zero needs a factor $10 = 2\\cdot 5$. Which prime is in shorter supply?",
    "Count multiples of $5$, then the extra $5$ inside multiples of $25$, then $125$, and so on."
  ],
  "solution": "By Legendre's formula the power of $5$ in $2026!$ is $\\lfloor 2026/5\\rfloor + \\lfloor 2026/25\\rfloor + \\lfloor 2026/125\\rfloor + \\lfloor 2026/625\\rfloor = 405+81+16+3 = 505$. There are more than enough $2$s, so $2026!$ ends in $505$ zeros.",
  "provenance": {
    "kind": "original",
    "author": "kevinvariant"
  },
  "verification": "seed-unverified",
  "stats": {
    "solves": 0,
    "attempts": 0,
    "liked": 0
  }
}
