{
  "id": "flipping-half-the-strings",
  "title": "Flipping Half the Strings",
  "kyu": 3,
  "topic": "C",
  "subtopics": [
    "double-counting",
    "correct-for-overcounting",
    "favorable-over-total"
  ],
  "type": "answer",
  "status": "beta",
  "statement": "Let $V$ be the set of all $16$ binary strings of length $4$. For a nonempty set $P \\subseteq \\{1,2,3,4\\}$ and a string $s \\in V$, let $s^P$ be the string obtained from $s$ by flipping the bits in the positions belonging to $P$, leaving the other bits unchanged.\n\nA subset $S$ of $V$ with exactly $8$ elements is chosen uniformly at random from all such subsets. The probability that there exists a nonempty set $P \\subseteq \\{1,2,3,4\\}$ for which $\\{s^P : s \\in S\\}$ and $S$ are disjoint is $\\frac{m}{n}$, where $m$ and $n$ are relatively prime positive integers. Find $m + n$.",
  "answer_format": "integer_0_999",
  "answer_hash": "cd7f3a91",
  "hints": [
    "Since $|S| = 8$, what must the flipped set $\\{s^P : s \\in S\\}$ be if it is disjoint from $S$? For a fixed $S$, consider the collection of all sets $P$ that work, and what happens when you apply two flips in succession.",
    "Write $V = \\mathbb{F}_2^4$, so that flipping $P$ is adding a nonzero vector $v$, and a working $v$ means that the indicator $f$ of $S$ satisfies $f(x+v) = f(x)+1$ for all $x$. Use double counting on pairs $(S, v)$: each $v$ is easy to count on its own, but one $S$ may have several working vectors. The vectors $v$ for which $f(x+v)-f(x)$ is constant form a subspace $L$, and this constant is linear in $v$, so the number of working vectors is $\\frac{1}{2}|L|$.",
    "By the second hint, a good $S$ has $1$, $2$, $4$ or $8$ working vectors, according to whether $\\dim L$ is $1$, $2$, $3$ or $4$. Dimension $3$ cannot occur, because $f$ would then be affine and $L$ would be all of $V$. Dimension $4$ gives the $30$ nonconstant affine functions. Dimension $2$ gives $105 \\cdot 8 = 840$ functions, from $105$ pairs (subspace, nonzero linear functional) with $8$ non-affine functions each. Each of the $15$ vectors works for $2^8$ sets, so the pair count is $3840$. Use this to find the number of sets with exactly one working vector."
  ],
  "solution": "Identify $V$ with $\\mathbb{F}_2^4$. A nonempty $P$ corresponds to the nonzero vector $v$ with support $P$, and $s^P = s + v$. Let $f : V \\to \\mathbb{F}_2$ be the indicator function of $S$. Since $S + v$ and $S$ both have size $8$, they are disjoint exactly when $S + v$ is the complement of $S$, that is, when $f(x+v) = f(x)+1$ for all $x$. Call such a $v$ <b>working</b> for $f$. Any $f$ with a working vector takes each value $8$ times, so it is the indicator of an $8$-element set. We count the functions $f$ that have at least one working vector.\n\n<b>Structure of the working vectors.</b> Let $L$ be the set of $v \\in V$ for which $f(x+v)-f(x)$ is a constant $c(v)$, independent of $x$. If $u, v \\in L$, then $f(x+u+v) = f(x+u)+c(v) = f(x)+c(u)+c(v)$. So $L$ is a subspace and $c : L \\to \\mathbb{F}_2$ is linear. The working vectors are exactly the solutions of $c(v) = 1$. If there is at least one, then $c \\ne 0$, so the working vectors are the complement of the hyperplane $\\ker c$ in $L$, and there are $2^{d-1}$ of them, where $d = \\dim L \\ge 1$. Let $a_1, a_2, a_4, a_8$ be the numbers of functions with $1, 2, 4, 8$ working vectors, corresponding to $d = 1, 2, 3, 4$.\n\n<b>The case $d = 4$.</b> Here $f(x) = f(0) + c(x)$ with $c \\ne 0$, so $f$ is a nonconstant affine function. Conversely, every nonconstant affine function has $L = V$ and $c \\ne 0$. There are $15$ nonzero linear functionals and $2$ choices of constant, so $a_8 = 30$.\n\n<b>The case $d = 3$.</b> This cannot occur. Take $w \\notin L$, so that $V = L \\cup (L+w)$. For $x \\in L$ we have $f(x) = f(0)+c(x)$ and $f(w+x) = f(w)+c(x)$. Extending $c$ linearly by $c(w) = f(w)+f(0)$ gives $f(y) = f(0)+c(y)$ for all $y \\in V$. So $f$ is affine and $L = V$, a contradiction. Thus $a_4 = 0$.\n\n<b>The case $d = 2$.</b> Each such $f$ determines a unique pair $(L, c)$, where $L$ is a $2$-dimensional subspace and $c$ is a nonzero linear functional on $L$. There are $\\frac{15 \\cdot 14}{3 \\cdot 2} = 35$ subspaces and $3$ functionals on each, giving $105$ pairs.\n\nFix a pair $(L, c)$ and consider the functions satisfying $f(x+y) = f(x)+c(y)$ for all $x \\in V$ and $y \\in L$. Such a function is determined by its values on representatives of the $4$ cosets of $L$, and these values are free, so there are $2^4 = 16$ functions. The affine ones among them are $\\ell + b$, where $\\ell$ is a linear extension of $c$ to $V$ ($4$ choices) and $b$ is a constant ($2$ choices), which makes $8$. The other $8$ are not affine. Their subspace of constant differences contains the given $L$, and it has dimension neither $4$ (they are not affine) nor $3$ (shown above), so it is exactly $L$. Hence $a_2 = 105 \\cdot 8 = 840$.\n\n<b>The case $d = 1$, by double counting.</b> Count pairs $(f, v)$ with $v$ working for $f$. For a fixed nonzero $v$, the space $V$ splits into $8$ pairs $\\{x, x+v\\}$. On each pair, $f$ must take two different values, which can be done in $2$ ways, so there are $2^8$ functions. Therefore\n$$15 \\cdot 256 = a_1 + 2a_2 + 4a_4 + 8a_8 = a_1 + 1680 + 0 + 240,$$\nwhich gives $a_1 = 1920$.\n\nThe number of good sets is $1920 + 840 + 30 = 2790$, out of $\\binom{16}{8} = 12870$ subsets, so the probability is\n$$\\dfrac{2790}{12870} = \\dfrac{31}{143},$$\nwhich is in lowest terms because $143 = 11 \\cdot 13$. Thus $m + n = 31 + 143 = 174$.\n\n<b>Why this works.</b> <code>double-counting</code>, <code>correct-for-overcounting</code>: each flip is easy to count alone, and the subspace structure of the working vectors gives the exact multiplicity with which each set is overcounted.",
  "provenance": {
    "kind": "original",
    "author": "kyuclid",
    "pipeline_run": "pilot-1"
  },
  "stats": {
    "solves": 0,
    "attempts": 0,
    "liked": 0
  },
  "verification": "gate-2026-10-31-flipping-half-the-strings"
}
