{
  "id": "sides-from-a-cubic",
  "title": "Sides From a Cubic",
  "kyu": 4,
  "topic": "A",
  "subtopics": [
    "polynomial-factoring",
    "triangle-inequality"
  ],
  "type": "answer",
  "status": "beta",
  "statement": "For a positive integer $k$, consider the cubic equation in $x$\n$$\\sqrt{k}\\,x^3 - (2k + 720)x^2 + 1690\\sqrt{k}\\,x - 180000 = 0.$$\nFind the number of positive integers $k$ for which the three roots of this equation, counted with multiplicity, are all real and positive and are the side lengths of a non-degenerate triangle.",
  "answer_format": "integer_0_999",
  "answer_hash": "fb4e40da",
  "hints": [
    "Don't treat this as a cubic in $x$ straight away. Put $c = \\sqrt{k}$, so that $2k = 2c^2$, and see what kind of expression the left side is in $c$.",
    "Factorise the left side. With $c = \\sqrt{k}$, it is a quadratic in $c$ with coefficients depending on $x$. Look for a factor that is linear in both $c$ and $x$, using $180000 = 720 \\cdot 250$ as a guide.",
    "The equation factorises as $(cx - 720)(x^2 - 2cx + 250) = 0$, where $c = \\sqrt{k}$. So the roots are $\\frac{720}{c}$ and $c \\pm \\sqrt{k - 250}$. Applying the triangle inequality to these roots gives $k > 360$ and $k(k - 250) < 360^2$. It remains to count the integers $k$ satisfying both."
  ],
  "solution": "Let $c = \\sqrt{k} > 0$. Expanding directly shows that\n$$\\sqrt{k}\\,x^3 - (2k + 720)x^2 + 1690\\sqrt{k}\\,x - 180000 = (cx - 720)(x^2 - 2cx + 250).$$\nSo the three roots, counted with multiplicity, are $p = \\frac{720}{c}$ and the two roots of $x^2 - 2cx + 250 = 0$.\n\nThe quadratic has discriminant $4(k - 250)$, so its roots are real exactly when $k \\ge 250$. In that case they are $u = c + s$ and $v = c - s$, where $s = \\sqrt{k - 250} \\ge 0$. Since $u + v = 2c > 0$ and $uv = 250 > 0$, both are positive, and $u \\ge v$. The root $p$ is always positive. Hence all three roots are real and positive exactly when $k \\ge 250$.\n\nNow assume $k \\ge 250$. The three roots form a non-degenerate triangle exactly when $p < u + v$, $u < p + v$ and $v < p + u$. The last of these always holds, because $v \\le u$ and $p > 0$. The other two are as follows.\n\nThe inequality $p < u + v$ says $\\frac{720}{c} < 2c$, which is $c^2 > 360$, that is, $k > 360$.\n\nThe inequality $u < p + v$ says $2s < \\frac{720}{c}$, which is $sc < 360$. Both sides are non-negative, so squaring gives the equivalent condition $k(k - 250) < 360^2 = 129600$.\n\nSince $k > 360$ already implies $k \\ge 250$, we need exactly the integers $k > 360$ with $k(k - 250) < 129600$. For $k > 250$, both factors of $k(k - 250)$ are positive and increasing, so the product is increasing. We have $506 \\cdot 256 = 129536 < 129600$ and $507 \\cdot 257 = 130299 > 129600$, so the second condition means $k \\le 506$ in this range.\n\nTherefore the valid values are $k = 361, 362, \\dots, 506$, and their number is $506 - 360$. The answer is $146$.\n\n<b>Why this works.</b> <code>polynomial-factoring</code>, <code>triangle-inequality</code>: viewing the cubic as a quadratic in $\\sqrt{k}$ makes it factorise, giving explicit roots that turn the triangle conditions into simple bounds on $k$.",
  "provenance": {
    "kind": "original",
    "author": "kyuclid",
    "pipeline_run": "pilot-1"
  },
  "stats": {
    "solves": 0,
    "attempts": 0,
    "liked": 0
  },
  "verification": "gate-2026-10-31-sides-from-a-cubic"
}
