{
  "id": "multiples-of-thirteen",
  "title": "Multiples of Thirteen",
  "kyu": 4,
  "topic": "N",
  "subtopics": [
    "modular-arithmetic",
    "orders-mod-n",
    "roots-of-unity",
    "vieta",
    "inclusion-exclusion"
  ],
  "type": "answer",
  "status": "beta",
  "statement": "For each positive integer $n$, let\n\n$$P_n = \\prod_{\\omega^n = 1} \\left(\\omega^2 + 5\\omega + 2\\right),$$\n\nwhere the product is taken over all $n$ distinct complex numbers $\\omega$ satisfying $\\omega^n = 1$. It can be shown that every $P_n$ is an integer.\n\nFind the number of positive integers $n$ with $n \\le 999$ such that $P_n$ is divisible by $13$.",
  "answer_format": "integer_0_999",
  "answer_hash": "33b249c2",
  "hints": [
    "Let $r_1, r_2$ be the roots of $x^2 + 5x + 2$, so each factor of $P_n$ is $(\\omega - r_1)(\\omega - r_2)$. Consider what $\\prod_{\\omega^n = 1}(\\omega - r)$ equals for a fixed number $r$, given that $\\prod_{\\omega^n = 1}(x - \\omega) = x^n - 1$.",
    "The product equals $P_n = (r_1^n - 1)(r_2^n - 1) = 2^n - s_n + 1$, where $s_n = r_1^n + r_2^n$. The closed form for $s_n$ is awkward, because the roots are irrational. Use modular arithmetic instead: modulo $13$, the quadratic $x^2 + 5x + 2$ has integer roots.",
    "Modulo $13$ we have $x^2 + 5x + 2 \\equiv (x - 3)(x - 5)$. So $s_n$ and $3^n + 5^n$ satisfy the same recurrence modulo $13$ with the same starting values, which gives $P_n \\equiv (3^n - 1)(5^n - 1) \\pmod{13}$. Now find the multiplicative orders of $3$ and $5$ modulo $13$ to get a condition on $n$, then count the values of $n$ up to $999$."
  ],
  "solution": "Let $r_1, r_2$ be the roots of $x^2 + 5x + 2$, so $r_1 + r_2 = -5$ and $r_1 r_2 = 2$. Then $\\omega^2 + 5\\omega + 2 = (\\omega - r_1)(\\omega - r_2)$.\n\nSince $\\prod_{\\omega^n = 1}(x - \\omega) = x^n - 1$, for any number $r$ we have $\\prod_{\\omega^n = 1}(\\omega - r) = (-1)^n (r^n - 1)$. Applying this to $r_1$ and $r_2$, the two signs cancel and\n$$P_n = (r_1^n - 1)(r_2^n - 1) = (r_1 r_2)^n - (r_1^n + r_2^n) + 1 = 2^n - s_n + 1,$$\nwhere $s_n = r_1^n + r_2^n$.\n\nEach $r_i$ satisfies $x^2 = -5x - 2$, so $s_n = -5 s_{n-1} - 2 s_{n-2}$ for $n \\ge 2$, with $s_0 = 2$ and $s_1 = -5$. Hence every $s_n$ is an integer.\n\nNow work modulo $13$. Let $t_n = 3^n + 5^n$. Then $t_n = 8 t_{n-1} - 15 t_{n-2}$, and since $8 \\equiv -5$ and $15 \\equiv 2 \\pmod{13}$, this gives $t_n \\equiv -5 t_{n-1} - 2 t_{n-2} \\pmod{13}$. Also $t_0 = 2 = s_0$ and $t_1 = 8 \\equiv -5 = s_1 \\pmod{13}$. By induction, $s_n \\equiv 3^n + 5^n \\pmod{13}$ for all $n \\ge 0$. Since $2 \\equiv 15 = 3 \\cdot 5 \\pmod{13}$, we also have $2^n \\equiv 3^n \\cdot 5^n \\pmod{13}$. Therefore\n$$P_n \\equiv 3^n \\cdot 5^n - 3^n - 5^n + 1 = (3^n - 1)(5^n - 1) \\pmod{13}.$$\n\nBecause $13$ is prime, $13 \\mid P_n$ exactly when $13 \\mid 3^n - 1$ or $13 \\mid 5^n - 1$. We have $3^3 = 27 \\equiv 1 \\pmod{13}$ and $3 \\not\\equiv 1 \\pmod{13}$, so $3$ has order $3$. We also have $5^2 = 25 \\equiv -1 \\pmod{13}$, so $5^4 \\equiv 1$ while $5^2 \\not\\equiv 1$, and $5$ has order $4$. Hence $13 \\mid P_n$ exactly when $3 \\mid n$ or $4 \\mid n$.\n\nBy inclusion–exclusion, the number of such $n \\le 999$ is\n$$\\left\\lfloor \\dfrac{999}{3} \\right\\rfloor + \\left\\lfloor \\dfrac{999}{4} \\right\\rfloor - \\left\\lfloor \\dfrac{999}{12} \\right\\rfloor = 333 + 249 - 83 = 499.$$\nThe answer is $499$.\n\n<b>Why this works.</b> <code>modular-arithmetic</code>, <code>orders-mod-n</code>: the quadratic splits modulo $13$ with roots $3$ and $5$, so divisibility of $P_n$ depends only on when powers of those roots return to $1$.",
  "provenance": {
    "kind": "original",
    "author": "kyuclid",
    "pipeline_run": "pilot-1"
  },
  "stats": {
    "solves": 0,
    "attempts": 0,
    "liked": 0
  },
  "verification": "gate-2026-10-31-multiples-of-thirteen"
}
